{
  "$schema": "http://json-schema.org/draft-07/schema#",
  "title": "AI Tool Registry Entry (Phase 3 §9)",
  "type": "object",
  "required": ["id", "name", "vendor", "category", "summary", "capabilities", "docsUrl", "lastVerified", "verifier", "tier"],
  "properties": {
    "id": {
      "type": "string", "pattern": "^[a-z0-9-]+$",
      "description": "Stable key. Referenced by lesson `tools:` frontmatter and <RegistryCard id>. NEVER change it when a product is renamed — change `name` instead."
    },
    "name": {
      "type": "string",
      "description": "Current product name, as shown to learners. This is the field a rebrand changes (e.g. NotebookLM -> Gemini Notebook, July 2026)."
    },
    "vendor": { "type": "string" },
    "category": { "enum": ["assistant", "image", "video", "voice", "coding", "automation", "framework", "open-model", "workspace"] },
    "summary": { "type": "string", "minLength": 40, "maxLength": 240 },
    "capabilities": {
      "type": "object",
      "properties": {
        "chat": { "type": "boolean" }, "vision": { "type": "boolean" },
        "files": { "type": "boolean" }, "voice": { "type": "boolean" },
        "webSearch": { "type": "boolean" }, "api": { "type": "boolean" }
      }
    },
    "freeTierNotes": { "type": "string" },
    "docsUrl": { "type": "string", "format": "uri", "description": "The documentation link shown to learners." },
    "watchUrl": { "type": "string", "format": "uri", "description": "Optional. What scripts/check-sources.mjs reads instead of docsUrl, for vendors whose docs block scripted fetches or who publish a changelog that is a better change signal. Never shown to learners." },
    "tosNotes": { "type": "string" },
    "lastVerified": { "type": "string", "pattern": "^\\d{4}-\\d{2}-\\d{2}$" },
    "verifier": { "type": "string" },
    "tier": { "enum": ["A", "B", "C"] },
    "status": { "enum": ["active", "archived"], "default": "active" }
  }
}
