{
  "id": "perplexity",
  "name": "Perplexity",
  "vendor": "Perplexity AI",
  "category": "assistant",
  "summary": "An answer engine that combines AI models with live web search and cited sources, suited to research-style questions, with free and paid tiers.",
  "capabilities": { "chat": true, "vision": true, "files": true, "voice": false, "webSearch": true, "api": true },
  "freeTierNotes": "Free tier with daily limits on advanced searches — check the official site for current limits.",
  "docsUrl": "https://docs.perplexity.ai/",
  "tosNotes": "Educational interactive use by end learners; no resale of access. Review current usage policies before enabling lab adapters.",
  "lastVerified": "2026-10-15",
  "verifier": "core-team",
  "tier": "B",
  "status": "active"
}
