{
  "id": "gemini",
  "name": "Gemini",
  "vendor": "Google",
  "category": "assistant",
  "summary": "Google's AI assistant integrated across its ecosystem, handling conversation, writing, coding, and multimodal input, with free access and paid tiers.",
  "capabilities": { "chat": true, "vision": true, "files": true, "voice": true, "webSearch": true, "api": true },
  "freeTierNotes": "Free tier available; API has a developer free tier with limits that change over time — verify current terms.",
  "docsUrl": "https://ai.google.dev/",
  "watchUrl": "https://blog.google/products/gemini/",
  "tosNotes": "Educational interactive use by end learners; no resale of access. Review current usage policies before enabling lab adapters.",
  "lastVerified": "2026-10-15",
  "verifier": "core-team",
  "tier": "A",
  "status": "active"
}
