{
  "id": "claude",
  "name": "Claude",
  "vendor": "Anthropic",
  "category": "assistant",
  "summary": "AI assistant by Anthropic for conversation, writing, analysis, coding, and document work, known for long-context handling, available on web and mobile with free and paid tiers.",
  "capabilities": { "chat": true, "vision": true, "files": true, "voice": true, "webSearch": true, "api": true },
  "freeTierNotes": "Free tier available with usage limits that change over time — check the official site for current limits.",
  "docsUrl": "https://docs.claude.com/",
  "watchUrl": "https://platform.claude.com/docs/en/release-notes/overview",
  "tosNotes": "Educational interactive use by end learners; no resale of access. Review current usage policies before enabling lab adapters.",
  "lastVerified": "2026-10-15",
  "verifier": "core-team",
  "tier": "A",
  "status": "active"
}
