{
  "id": "meta-ai",
  "name": "Meta AI",
  "vendor": "Meta",
  "category": "assistant",
  "summary": "Meta's assistant inside WhatsApp, Instagram, Messenger, and a standalone app — AI where billions already chat. The models behind it change, and Meta's newest are not released as open weights.",
  "capabilities": { "chat": true, "vision": true, "files": false, "voice": true, "webSearch": true, "api": false },
  "freeTierNotes": "Free within Meta's apps; feature availability varies by region and changes over time.",
  "docsUrl": "https://www.meta.ai/",
  "watchUrl": "https://about.fb.com/news/",
  "tosNotes": "Educational interactive use; note in-app data-handling terms differ from standalone assistants.",
  "lastVerified": "2026-10-15",
  "verifier": "core-team",
  "tier": "B",
  "status": "active"
}
