{
  "id": "github-copilot",
  "name": "GitHub Copilot",
  "vendor": "GitHub (Microsoft)",
  "category": "coding",
  "summary": "One of the most widely used AI coding assistants — inline suggestions, chat, and agentic edits inside editors like VS Code and on GitHub itself.",
  "capabilities": { "chat": true, "vision": false, "files": true, "voice": false, "webSearch": false, "api": false },
  "freeTierNotes": "Free tier with monthly limits exists; student/educator free access programs available — specifics change over time.",
  "docsUrl": "https://docs.github.com/copilot",
  "tosNotes": "Check employer policy before use on work code; suggestion-matching settings matter for licensing.",
  "lastVerified": "2026-10-15",
  "verifier": "core-team",
  "tier": "B",
  "status": "active"
}
