{
  "id": "copilot",
  "name": "Microsoft Copilot",
  "vendor": "Microsoft",
  "category": "assistant",
  "summary": "Microsoft's AI assistant woven through Windows, Edge and Microsoft 365 — chat plus in-document help. In 2026 the personal and work apps are being merged into one Copilot app.",
  "capabilities": { "chat": true, "vision": true, "files": true, "voice": true, "webSearch": true, "api": false },
  "freeTierNotes": "Free tier available; deeper Microsoft 365 integration is tied to paid plans that change over time — check official docs.",
  "docsUrl": "https://support.microsoft.com/copilot",
  "tosNotes": "Educational interactive use by end learners; work-account data handling differs from consumer — see official terms.",
  "lastVerified": "2026-10-15",
  "verifier": "core-team",
  "tier": "B",
  "status": "active"
}
