{
  "id": "notion-ai",
  "name": "Notion AI",
  "vendor": "Notion",
  "category": "workspace",
  "summary": "AI built into the Notion workspace: writing help, Q&A across your pages and connected docs, meeting notes, AI-filled database fields, and agents that do multi-step work.",
  "capabilities": { "chat": true, "vision": false, "files": true, "voice": false, "webSearch": true, "api": false },
  "freeTierNotes": "AI features are largely tied to paid plans with trial allowances — specifics change over time.",
  "docsUrl": "https://www.notion.com/help",
  "tosNotes": "Workspace Q&A reads what it's connected to — review sharing/permission settings first.",
  "lastVerified": "2026-10-15",
  "verifier": "core-team",
  "tier": "C",
  "status": "active"
}
