{
  "id": "notebooklm",
  "name": "Gemini Notebook",
  "vendor": "Google",
  "category": "workspace",
  "summary": "Google's source-grounded research tool, renamed from NotebookLM in July 2026: upload documents and it answers only from them, citing your sources, plus audio overviews.",
  "capabilities": { "chat": true, "vision": false, "files": true, "voice": true, "webSearch": false, "api": false },
  "freeTierNotes": "Free tier with source and notebook limits; paid tier raises limits — specifics change over time.",
  "docsUrl": "https://notebook.google/",
  "watchUrl": "https://blog.google/innovation-and-ai/products/gemini-notebook/",
  "tosNotes": "Educational interactive use; check data-handling terms before uploading sensitive documents.",
  "lastVerified": "2026-10-15",
  "verifier": "core-team",
  "tier": "B",
  "status": "active"
}
